<?xml version="1.0" encoding="utf-8"?>
<!DOCTYPE knimeNode PUBLIC "-//UNIKN//DTD KNIME Node 2.0//EN" "http://www.knime.org/Node.dtd">
<knimeNode icon="./case_converter.png" type="Manipulator">
	<name>Case Converter</name>
	
	<shortDescription>
	    This node converts alphanumeric characters to lowercase or UPPERCASE.
	</shortDescription>
	
	<fullDescription>
		<intro>
			This node converts alphanumeric characters to lowercase or UPPERCASE.
		</intro>
		<option name="Select Mode">
		<p>
		<b>Convert to UPPERCASE</b> : Selected string columns are transformed to uppercase. 
		</p>
		<p>
		<b>Convert to lowercase</b>: Selected string columns are transformed to lowercase.</p></option>	
		<option name="Column Selection">Move the columns of interest into the &quot;Include&quot; list</option>
	</fullDescription>
	
	<ports>
		<inPort index="0" name="Input">Arbitrary input data.</inPort>
		<outPort index="0" name="Transformed input">Input data with transformed string values.</outPort>
	</ports>	
</knimeNode>
