<?xml version="1.0" encoding="utf-8"?>
<!DOCTYPE knimeNode PUBLIC "-//UNIKN//DTD KNIME Node 2.0//EN" "http://www.knime.org/Node.dtd">
<knimeNode icon="./string_number.png" type="Manipulator">
	<name>String To Number</name>
	
	<shortDescription>
	    Converts strings in a column to numbers.
	</shortDescription>
	
	<fullDescription>
		<intro>
			Converts strings in a column (or a set of columns) to numbers.
			If the node fails to parse a string, it will generate a missing cell and append
	    	a warning message to the KNIME Console with detailed information.
		</intro>
		  <option name="Type">Choose the DataType that your string should
		  be converted to.</option>
    	<option name="Decimal Separator">Choose a decimal separator, 
		which is used to mark the boundary between the integral and the 
		fractional parts of the decimal string.</option>
		<option name="Thousands Separator">Choose a thousands separator 
		used in the decimal string to group together three digits.</option>
		<option name="Accept type suffix, e.g. 'd', 'D', 'f', 'F'">When checked, the type suffix will be
		accepted, otherwise it fails to parse input like <tt>1d</tt>. These suffixes are typically used
        in java-style programs to represent floating point numbers ('f' for float and 'd' for double). Default is 
        not checked. </option>
		<option name="Column Selection">
		Move the columns of interest into the
		&quot;Include&quot; list</option>
		
		
	</fullDescription>
	
	<ports>
		<inPort index="0" name="Input">Arbitrary input data.</inPort>
		<outPort index="0" name="Transformed input">Input data with new DoubleTypes.</outPort>
	</ports>	
</knimeNode>
