<?xml version="1.0" encoding="utf-8"?>
<!DOCTYPE knimeNode PUBLIC "-//UNIKN//DTD KNIME Node 2.0//EN" "http://www.knime.org/Node.dtd">
<knimeNode icon="./normalizeapply.png" type="Manipulator">
    <name>Normalizer (Apply)</name>
    <shortDescription>Normalizes the attributes of a table according to a model.</shortDescription>
    <fullDescription>
        <intro>
	        <p>
        	This node normalizes the input data according to the normalization parameters
        	as given in the model input (typically coming from the Normalizer node). It
        	will apply an affine transformation to all columns in the input data that
        	are contained in the model input.
        	</p>
        	<p>
        	This node is typically used when test data shall be normalized the same
        	way the training data has been normalized (using the "Normalizer" node).
        	</p>
		</intro>
	</fullDescription>
    <ports>
        <inPort index="0" name="Model">Normalization parameters</inPort>
        <inPort index="1" name="Table to normalize">Table requiring normalization of some or all columns.</inPort>
        <outPort index="0" name="Normalized output">The input data normalized according to the normalization parameters.</outPort>
	</ports>
</knimeNode>
