<?xml version="1.0" encoding="utf-8"?>
<!DOCTYPE knimeNode PUBLIC "-//UNIKN//DTD KNIME Node 2.0//EN" "http://www.knime.org/Node.dtd">
<knimeNode icon="./SVM_predict.png" type="Predictor" deprecated="true">
	<name>SVM Predictor</name>
	<shortDescription>
	    This node uses a SVM model generated by the SVM learner
		node to predict the output for given parameters.
	</shortDescription>
	
	<fullDescription>
	<intro>
		This node uses a SVM model generated by the SVM learner
		node to predict the output for given values. Only the columns
		that have been used during training are used in
		the SVM learner. The output table will contain one extra
		column, which contains the prediction. There is no need
		to configure this node.
		</intro>
	</fullDescription>
	
	<ports>
		<inPort index="0" name = "Trained SVM">The model generated by the SVM Learner</inPort>
		<inPort index="1" name = "Test Data">Inport for the input table</inPort>
		<outPort index="0" name = "Classification">The input table, with the prediction column appended to it.</outPort>
	</ports>	
</knimeNode>