<?xml version="1.0" encoding="utf-8"?>
<!DOCTYPE knimeNode PUBLIC "-//UNIKN//DTD KNIME Node 2.0//EN" "http://www.knime.org/Node.dtd">
<knimeNode icon="tablerow2variable_loop.png" type="LoopStart">
    <name>Table Row To Variable Loop Start</name>
    
    <shortDescription>
        Iterates over an input data table, whereby each row defines on iteration
        with variable settings taken from the values in that row  
    </shortDescription>
    
    <fullDescription>
        <intro>
          This node uses each row of a data table to define new
          variable values for each loop iteration. The names of the variables
          are defined by the column names.
        </intro>
        <option name="Fail">If selected the node fails with an error on Missing Values or empty tables.</option>
		<option name="Defaults">If selected the node replaces Missing Values or empty table columns by either integer, double, or String values as defined.</option>
		<option name="Omit">If selected the node ignores Missing Values or empty table columns.</option>
    </fullDescription>
    
    <ports>
        <inPort index="0" name="Parameters table">The table whose 
          rows will constitute variables' values for each iteration.</inPort>
        <outPort index="0" name="Variable connection">
            The connection passing on the variable values to the next
            nodes.</outPort>
    </ports>
</knimeNode>
