<?xml version="1.0" encoding="utf-8"?>
<!DOCTYPE knimeNode PUBLIC "-//UNIKN//DTD KNIME Node 2.0//EN" "http://www.knime.org/Node.dtd">
<knimeNode type="Source" icon="./db_connection_reader.png">
	<name>Database Connection Table Reader</name>
	
	<shortDescription>
	    Reads the entire data from the input database connection.
	</shortDescription>
	
	<fullDescription>
		<intro>		
	     Opens a database connection based on the input settings and reads
	     the entire data table from the database into KNIME. 
		</intro>
		<option name="Use database row id">If enabled the KNIME row id is based on the row id returned from the database.
		An internal counter is used to generate the row id if the option is disabled.
		<b>If you encounter a duplicate key exception disable this option.</b> This is caused by a faulty implementation 
		of the used jdbc driver.</option>
	</fullDescription>
	
	<ports>
		<inPort index="0" name="Database Connection">Database connection to a table</inPort>
		<outPort index="0" name="Data read from Database">Database read from database</outPort>
	</ports>	
</knimeNode>