<?xml version="1.0" encoding="utf-8"?>
<!DOCTYPE knimeNode PUBLIC "-//UNIKN//DTD KNIME Node 2.0//EN" "http://www.knime.org/Node.dtd">
<knimeNode icon="save.png" type="Other">
    <name>Save Workflow</name>

    <shortDescription>
      Saves the workflow upon execution.   
    </shortDescription>

    <fullDescription>
        <intro>
            <p>
              Saves the workflow upon execution.
            </p>
        </intro>
    </fullDescription>

    <ports>
        <inPort index="0" name="Input">Ignored.</inPort>
        <outPort index="0" name="Output">Ignored.</outPort>
    </ports>
</knimeNode>
