<?xml version="1.0" encoding="utf-8"?>
<!DOCTYPE knimeNode PUBLIC "-//UNIKN//DTD KNIME Node 2.0//EN" "http://www.knime.org/Node.dtd">
<knimeNode icon="./refcolumnfilter.png" type="Manipulator">
	<name>Reference Column Filter</name>
	
	<shortDescription>
		The Reference Column Filter allows columns to be filtered from the first 
		table using the second table as reference.
	</shortDescription>
	
	<fullDescription>
		<intro>
			This node allows columns to be filtered from the first table using
			the second table as reference table. Depending on the dialog
			setting, either the columns from the reference table are included or
			excluded in the output table.
		</intro>
		
		<option name="In-/Exclude columns from reference table">
			Includes or excludes all columns from the reference table into the
			resulting table from the first input.
		</option>

        <option name="Ensure compatibility of column types">
            Ensures that the matching columns don't only have the same name but
            also the same type. Columns are only included or
            excluded if the column type of the first table is a super-type of
            the column type from the second table. If not selected, only the 
            column names need to match.
        </option>
		
	</fullDescription>
	
	<ports>
		<inPort index="0" name="Table to be filtered">
			Table from which columns are to be included or excluded
		</inPort>
		<inPort index="1" name="Reference table">
            Table with the columns used as references
        </inPort>
		<outPort index="0" name="Filtered table">
			Table with filtered columns
		</outPort>
	</ports>	
</knimeNode>