<?xml version="1.0" encoding="utf-8"?>
<!DOCTYPE knimeNode PUBLIC "-//UNIKN//DTD KNIME Node 2.0//EN" "http://www.knime.org/Node.dtd">
<knimeNode type="Visualizer" icon="./size_appender.png">
	<name>Size Appender</name>
	
	<shortDescription>
	    Appends sizes to one selected column.
	</shortDescription>
	
	<fullDescription>
		<intro>
		<p>
		Appends an existing size model (SizeHandler) to one selected column
		of the input table. 		
	    </p>
	    <p>
	    This may be useful if the column for which the size model is defined gets
	    lost somewhere in the workflow, is replaced by another column, or if there
	    are two different datasets with the same class column. 
	    </p>
		</intro>
	    <option name="Append sizes to: ">
		    Select the column to apply the size model to. It might be the same 
		    column, a different numeric column for which the size model should 
		    be reused, or a nominal column if the size model was defined for 
		    nominal values. Then the possible values must be exactly the same. 
	    </option>
	</fullDescription>
	
	<ports>
		<inPort index="0" name="Size model">Size model which size settings</inPort>
		<inPort index="1" name="Table">Table to which size settings should be applied to</inPort>
		<outPort index="0" name="Table with sizes">Input table with size information applied to one column</outPort>
	</ports>	
</knimeNode>