<?xml version="1.0" encoding="utf-8"?>
<!DOCTYPE knimeNode PUBLIC "-//UNIKN//DTD KNIME Node 2.0//EN" "http://www.knime.org/Node.dtd">
<knimeNode icon="extracttabledimension.png" type="Other">
    <name>Extract Table Dimension</name>
    <shortDescription>Extracts the number of rows and columns of the input table
        and outputs them as data table and flow variables.  
    </shortDescription>
    <fullDescription>
        <intro>
			The number of rows and columns of the input table are 
			extracted and written to the output table. The output table consists
			of two rows and one column. The first row contains the number of
			rows and the second row contains the number of columns of the input
			table. Additionally the two numbers are pushed out as flow 
			variables.		
		</intro>
	</fullDescription>
		
	<ports>
        <inPort name="Input table with dimensions to extract" index="0">
            The input table for which dimensions are extracted.
        </inPort>
        <outPort name="Table containing dimensions" index="0">
        	The output table containing the dimensions of the input table.
        </outPort>
	</ports>
</knimeNode>