<?xml version="1.0" encoding="utf-8"?>
<!DOCTYPE knimeNode PUBLIC "-//UNIKN//DTD KNIME Node 2.0//EN" "http://www.knime.org/Node.dtd">
<knimeNode icon="./categoryToNumber.png" type="Manipulator">
	<name>Category To Number</name>
	
	<shortDescription>
		Maps each category of a column with nominal data to an integer.
	</shortDescription>
	
	<fullDescription>
		<intro>
		This node takes columns with nominal data and maps every category to
		an integer. For your convenience, you can process multiple columns with this
		node. However, these columns are processed separately as if you would
	    use a single Cateory To Number node for every column.
		</intro>
			<option name="Columns">
				Include the columns that should be processed. You can only
				include columns with nominal data. 
			</option>
            <option name="Append columns">
                If checked, the computed columns will be appended to the 
                input table. Otherwise the computed columns replace the 
                columns in the include list. 
            </option>
            <option name="Column suffix">
                The column name of the computed columns are the name of the 
                column in the input appended by this suffix.
            </option>
            <option name="Start value">
                The category in the first row will be mapped to this value.
            </option>
            <option name="Increment">
                The i-th category is mapped to the value i * Increment + Start value.
            </option>
            <option name="Max. categories">
                Processing is interrupted for inputs with more than categories
                than max. categories. 
            </option>
            <option name="Default value">
                This value is used when the PMML model is applied. It defines 
                the value used when the input is not found in the mapping.
                Leave it empty to assign a missing cell in this case.
            </option>
            <option name="Map missing to">
                Missing cells are mapped to this value. You can enter any
                integer. If empty, missing cells will be mapped to missing cells.
            </option>
            </fullDescription>
	
	<ports>
		<inPort index="0" name="Data to process">Data</inPort>
		<inPort index="1" name="PMML Document">Optional PMML document to add the map values operations to.</inPort>
		<outPort index="0" name="Processed data">Data with transformed columns</outPort>
        <outPort index="1" name="Transformed PMML input">PMML port object that includes the performed operations.</outPort>
	</ports>	
</knimeNode>
